source,title,link,summary,published
The Guardian,"Taylor Swift soap, saucy socks and Pet Shop Boys tea sets: it’s the culture Christmas gift guide 2024",https://www.theguardian.com/culture/2024/dec/02/culture-christmas-gift-guide-2024,"<p>From a Snoop Dogg firepit to a sweater celebrating the brutalist genius of Preston bus station, here are 40 fabulous festive suggestions for the culture vulture in your life</p><p>It’s just turned December and – unless you’re far more organised than everyone else on the arts desk – you’ve not even thought about Christmas shopping yet. But, before you go traipsing off to every corner of the internet/high street in search of unique gifts, why not relax with a glass of sherry and simply treat the cultural connoisseur in your life to something from our bumper festive gift guide.</p><p>Featuring everything from a beautiful Japanese anti-smartphone poster to a Traitors hooded top, there’s no price range we haven’t covered (fine bone china Pet Shop Boys tea set, anyone?), no area of the arts left untouched (a Brutalism-inspired sweatshirt?) and absolutely no chance that anyone else has recommended you buy a lace hi-vis vest. We’ve even found the Mona Lisa at a decent price (OK, it’s made of Lego, but still).</p> <a href=""https://www.theguardian.com/culture/2024/dec/02/culture-christmas-gift-guide-2024"">Continue reading...</a>","Mon, 02 Dec 2024 05:00:15 GMT"
The Guardian,Poem of the week: In Drear Nighted December by John Keats,https://www.theguardian.com/books/2024/dec/02/poem-of-the-week-in-drear-nighted-december-by-john-keats,"<p>A wintry vision of the separation of two lovers gains fresh energy from the verse’s roots in folk song</p><p><strong>In Drear Nighted December</strong></p><p>In drear nighted December,<br />
 Too happy, happy tree,<br />
 Thy branches ne’er remember<br />
 Their green felicity —<br />
 The north cannot undo them<br />
 With a sleety whistle through them<br />
 Nor frozen thawings glue them<br />
 From budding at the prime.</p> <a href=""https://www.theguardian.com/books/2024/dec/02/poem-of-the-week-in-drear-nighted-december-by-john-keats"">Continue reading...</a>","Mon, 02 Dec 2024 10:00:21 GMT"
The Guardian,Madame Choi and the Monsters by Patrick Spät and Sheree Domingo review – the stuff of blockbusters,https://www.theguardian.com/books/2024/dec/02/madame-choi-and-the-monsters-by-patrick-spat-and-sheree-domingo-review-the-stuff-of-blockbusters,"<p>The astonishing real-life tale of how North Korea kidnapped an actor and her film director ex-husband makes for a fascinating graphic history</p><p>This graphic novel, published first in German, is based on a true story, and if you don’t already know that tale (I’m afraid I didn’t), it will astonish you. A successful actor and her movie director ex-husband are kidnapped by an enemy state, so that they might make movies to please a dictator. On paper, this is the stuff of a disaster-ridden major motion picture, dreamed up by some crazed auteur. But it really happened. In 1978, Choi Eun-Hee, a celebrated actor in her native South Korea, was kidnapped by North Korean agents in Hong Kong, and transported to the city of Namp’o, where she was met by Kim Jong-il, the son of the Great Leader, Kim Il-sung, and then head of the country’s propaganda unit and film studios.</p><p>When Choi’s ex-husband, the director Shin Sang-ok, travelled to Hong Kong to try to find her, the same thing happened to him – though having twice tried to escape, he was eventually sent to a prison camp to be tortured and kept in solitary confinement (Choi’s surroundings were luxurious, even if she was unable to leave them). In 1983, Kim initiated, with no advance warning, a meeting between Choi and Shin at a dinner in Pyongyang. Reunited, the two of them rekindled their relationship and Kim, the film fanatic, now explained the reason for their kidnapping: they were to shoot big-budget masterpieces for him, movies good enough to be shown at film festivals around the world. In the years that followed, they duly made several films, including <em>Pulgasari</em>, a North Korean version of <em>Godzilla</em>. In 1986, however, while they were at a festival in Vienna, they gave their guards the slip, and made it to the American embassy where they requested asylum.</p> <a href=""https://www.theguardian.com/books/2024/dec/02/madame-choi-and-the-monsters-by-patrick-spat-and-sheree-domingo-review-the-stuff-of-blockbusters"">Continue reading...</a>","Mon, 02 Dec 2024 09:00:19 GMT"
The Guardian,Flex your new visual super skills,https://www.theguardian.com/stand-out-by-design/ng-interactive/2024/nov/20/flex-your-new-visual-super-skills,"<p>We’ve all acquired new design smarts. Now it’s time to make the most of them</p> <a href=""https://www.theguardian.com/stand-out-by-design/ng-interactive/2024/nov/20/flex-your-new-visual-super-skills"">Continue reading...</a>","Wed, 20 Nov 2024 10:47:07 GMT"
The Guardian,From manifesting to manifestos: Steven Bartlett is spearheading a new approach to achieving your goals,https://www.theguardian.com/stand-out-by-design/2024/nov/04/from-manifesting-to-manifestos-steven-bartlett-is-spearheading-a-new-approach-to-achieving-your-goals,"<p>The entrepreneur has teamed up with Adobe Express to promote the benefits of creating your own personal manifesto</p><p>Steven Bartlett might be a visionary entrepreneur but he’s all-too aware that having vision isn’t enough on its own. As part of a partnership with Adobe Express, the quick and easy content app, he’s now on a mission to show people how to turn their vision into actionable steps with the help of a carefully-conceived manifesto that aligns with their goals and values. Calling it the “Manifest-o Method”, the idea is to provide a framework that can help guide entrepreneurs in their early stages. As he put it in an interview with Adobe: “Manifestation without action is like setting your car’s sat-nav without turning the engine on.”</p><p>When creating the Manifest-o Method, Bartlett, who is probably best known for The Diary of a CEO podcast and his appearances on BBC Dragons’ Den, drew on his own experience of creating and designing a business manifesto for his podcast company, Flight Studio, using Adobe Express.</p> <a href=""https://www.theguardian.com/stand-out-by-design/2024/nov/04/from-manifesting-to-manifestos-steven-bartlett-is-spearheading-a-new-approach-to-achieving-your-goals"">Continue reading...</a>","Mon, 04 Nov 2024 15:36:29 GMT"
The Guardian,‘Time-chunking’ and great design … side hustle experts give their tips for success,https://www.theguardian.com/stand-out-by-design/2024/oct/21/time-chunking-and-great-design-side-hustle-experts-give-their-tips-for-success,"<p>Nearly half of us now run a side gig alongside our regular job. Here’s how to make it work …</p><p>The side hustle has become central to modern living. Nearly <a href=""https://www.sage.com/en-gb/company/digital-newsroom/2024/06/04/nation-of-shopkeepers-is-now-nation-of-side-hustles/"" rel=""nofollow"">50% of Brits</a> have a side hustle, with nine out of 10 “side hustlers” who are under 34 planning to transition said hustle into a full-time business. But juggling your side hustle with your day job can be tricky even for the most skilled multitasker. So here are some tips for managing multiple gigs without annoying your boss or colleagues</p><p><strong>Compartmentalise while cross-fertilising <br /></strong>Try to view your day job as a source of inspiration and insights rather than an obstacle to your side-hustle. Your life will feel more coherent and less draining.</p> <a href=""https://www.theguardian.com/stand-out-by-design/2024/oct/21/time-chunking-and-great-design-side-hustle-experts-give-their-tips-for-success"">Continue reading...</a>","Mon, 21 Oct 2024 09:54:16 GMT"
The Guardian,‘The best personal brands aren’t overly curated’: six dos and don’ts for the jobs market,https://www.theguardian.com/stand-out-by-design/2024/nov/01/the-best-personal-brands-arent-overly-curated-six-dos-and-donts-for-the-jobs-market,"<p>Personal branding is far more complex than it once was, with evolving tech adding to the possibilities</p><p>Personal branding has undergone a radical rebranding. The way we showcase ourselves in the workplace and jobs market has been transformed by the tools at our disposal and societal shifts, such as the melding of work and life. Twenty-five years ago, you had a CV and, if you wanted a new job, you updated it and sent it to prospective employers. Your reputation may have enhanced your prospects but, when it came to job hunting, your qualifications and CV were pretty much the only showcase you had.</p><p>With the internet everything changed – and then changed again with social media and smartphones. Suddenly, you were visible to millions of people on a device they carried around in their pockets. Those same tools gave you the ability to step up from CVs to slickly presented websites and slide decks. And social media gave everyone a platform to build and manage their own personal brand in real time.</p> <a href=""https://www.theguardian.com/stand-out-by-design/2024/nov/01/the-best-personal-brands-arent-overly-curated-six-dos-and-donts-for-the-jobs-market"">Continue reading...</a>","Fri, 01 Nov 2024 13:59:22 GMT"
The Guardian,Off the Cretan track: skiing and climbing on the Greek island,https://www.theguardian.com/travel/2024/dec/02/skiing-and-climbing-on-crete-greece-island,"<p>Away from Crete’s sandy shores, tall peaks dominate the landscape, offering great skiing without the crowds – or ski lifts</p><p>At the summit of Mount Ida on Crete, I discovered a stone chapel with a frozen free-standing bell leaning against it – it was as if time had stood still. Outside winter, Eastern Orthodox priests and worshippers hike to the highest point on the Greek island, and services are held in the chapel. But it was February, when Ida is often buried under several metres of snow and only mountaineers and skiers climb the almost 2,500-metre peak. I took a moment to admire the 360-degree panorama – the Aegean Sea to the north, the Libyan Sea to the south. There was no one else in sight.</p><p>Akis Parousis, my guide, claimed that on a clear day you can see the lights of Alexandria in Egypt from here before he skied off, racing through the fresh, light powder. I took one last glance at the horizon, where a marine blue sea met a pale blue sky, and set off in pursuit.</p> <a href=""https://www.theguardian.com/travel/2024/dec/02/skiing-and-climbing-on-crete-greece-island"">Continue reading...</a>","Mon, 02 Dec 2024 07:00:19 GMT"
The Guardian,"HMRC is demanding I pay £7,662 tax on my £79 earnings",https://www.theguardian.com/money/2024/dec/02/hmrc-is-demanding-i-pay-7662-tax-on-my-79-earnings,"<p>I worked for just half a day for a charity but since then it insists I pay up via PAYE</p><p><strong>HMRC has been taxing me for a job I do not have for almost three years.</strong></p><p><strong>In March 2020 I did a half day’s work for a charity, Move On, for which I was paid £79.10. I was put on the payroll in the expectation that I would do more work there in the future. Instead, the pandemic happened and I never returned.</strong></p> <a href=""https://www.theguardian.com/money/2024/dec/02/hmrc-is-demanding-i-pay-7662-tax-on-my-79-earnings"">Continue reading...</a>","Mon, 02 Dec 2024 08:30:19 GMT"
The Guardian,The brain microbiome: could understanding it help prevent dementia?,https://www.theguardian.com/lifeandstyle/2024/dec/01/the-brain-microbiome-could-understanding-it-help-prevent-dementia,"<p>Long thought to be sterile, our brains are now believed to harbour all sorts of micro-organisms, from bacteria to fungi. How big a part do they play in Alzheimer’s and similar diseases?</p><p>Nine years ago, Nikki Schultek, an active and healthy woman in her early 30s, experienced a sudden cascade of debilitating and agonising symptoms – including cognitive and breathing problems and heart arrhythmia – and was investigated for <a href=""https://www.theguardian.com/society/multiple-sclerosis"">multiple sclerosis</a>. But three brain scans and numerous X-rays later, there was still no diagnosis or treatment plan. “It was like living in a nightmare, imagining not watching my children – three and five years old – grow up,” says Schultek.</p><p>Now, speaking on a video call from North Carolina, she is as bright as a button and shows no signs of degenerative brain disease. It turned out she had multiple chronic infections, including <em>Borrelia burgdorferi</em> bacteria, which causes Lyme disease and which had stealthily reached her brain. Antibiotics restored her health, but <em>B</em><em> burgdorferi</em> is hard to eradicate once in the brain. She may need maintenance treatment to keep the disease at bay.</p> <a href=""https://www.theguardian.com/lifeandstyle/2024/dec/01/the-brain-microbiome-could-understanding-it-help-prevent-dementia"">Continue reading...</a>","Sun, 01 Dec 2024 14:00:10 GMT"
The Guardian,From Trump and Musk to regurgitation: Edith Pritchett’s week in Venn diagrams – cartoon,https://www.theguardian.com/lifeandstyle/picture/2024/dec/02/from-trump-and-musk-to-regurgitation-edith-pritchetts-week-in-venn-diagrams-cartoon,"<a href=""https://www.theguardian.com/lifeandstyle/picture/2024/dec/02/from-trump-and-musk-to-regurgitation-edith-pritchetts-week-in-venn-diagrams-cartoon"">Continue reading...</a>","Mon, 02 Dec 2024 06:00:18 GMT"
The Guardian,Is it important for kids to learn about winning and losing?,https://www.theguardian.com/wellness/2024/dec/01/youth-sports-teaching-winning-losing,"<p>Some experts say the values of fun and personal development in youth sports are being replaced by performance and victory</p><p>My boyfriend’s parents coached youth sports teams in the 90s, so they have many anecdotes about how children handle winning and losing. Two cousins on separate soccer teams were so competitive that the one who lost would refuse the post-game high-five, instead retreating to some nearby bushes to cry. A little girl used to kick opponents with her ice skates during hockey; another refused to pass because her dad gave her cash for every goal she scored. One boy, when his team lost, lay flat out on the ice and simply wouldn’t get up.</p><p>There’s a general consensus that, in addition to boosting fitness, youth sports impart valuable life skills, like teamwork and discipline. Winning and losing are especially significant, because they prepare children for the setbacks and challenges they will face in adult life.</p> <a href=""https://www.theguardian.com/wellness/2024/dec/01/youth-sports-teaching-winning-losing"">Continue reading...</a>","Sun, 01 Dec 2024 13:00:08 GMT"
The Guardian,‘I felt like a bystander in my own internal recovery’: one woman’s battle for health after a life-changing diagnosis,https://www.theguardian.com/society/2024/dec/01/i-felt-like-a-bystander-in-my-own-internal-recovery-one-womans-battle-for-health-after-a-life-changing-diagnosis,"<p>Facing an enormous decision about her health filled Kat Lister with wonder at her body’s ability to fight for her</p><p>The 2cm wound to the right of my bellybutton had been oozing for days. A syrupy weep in the well of my abdomen. A surgical pothole so small that it felt almost indulgent to photograph it in my bathroom mirror. As if these tiny keyhole incisions dotted around my swollen stomach – one, two, three, four, five of them – bore no relation to the magnitude of the plunder beneath.</p><p>Magnitude. Or, should I say: weight. “Do you feel lighter?” a friend asked me a week after I had a total colectomy to save my life. To which I replied (somewhat contradictorily): yes and no. It didn’t take long for my doctors to start referring to my large bowel, laden with more than 400 precancerous polyps, as a “heavy burden” – and I think there is something poetic in that choice of words. A flash of humanity in an otherwise sterile place. Which is where I found myself in May last year, staring numbly at pictures of stoma bags in St Mark’s hospital in north-west London, the only hospital in the world to specialise entirely in intestinal and colorectal medicine.</p> <a href=""https://www.theguardian.com/society/2024/dec/01/i-felt-like-a-bystander-in-my-own-internal-recovery-one-womans-battle-for-health-after-a-life-changing-diagnosis"">Continue reading...</a>","Sun, 01 Dec 2024 09:00:02 GMT"
The Guardian,Share your experience of doorstep deliveries in the UK that have gone missing,https://www.theguardian.com/money/2024/dec/02/share-your-experience-of-doorstep-deliveries-in-the-uk-that-have-gone-missing,"<p>We want to hear from people about the items they have lost after they were delivered and left on their doorstep</p><p>Now that Black Friday has come and gone, we’d like to find out more about the deliveries you have received but that have gone missing from your doorstep.</p><p>Were you able to retrieve the lost parcel? If you raised the issue with the retailer or courier, what happened? Were you able to get a replacement or a refund?</p> <a href=""https://www.theguardian.com/money/2024/dec/02/share-your-experience-of-doorstep-deliveries-in-the-uk-that-have-gone-missing"">Continue reading...</a>","Mon, 02 Dec 2024 09:22:45 GMT"
The Guardian,Nature boys and girls – here’s your chance to get published in the Guardian,https://www.theguardian.com/environment/2021/aug/27/nature-lovers-guardian-young-country-diary-writers,"<p>Our wildlife series Young Country Diary is looking for articles written by children, about their winter encounters with nature</p><p>Once again, the <a href=""https://www.theguardian.com/environment/series/young-country-diary"">Young Country Diary series</a> is open for submissions! Every three months, as the UK enters a new season, we ask you to send us an article written by a child aged 8-14.</p><p>The article needs to be about a <strong>recent encounter they’ve had with nature</strong> – whether it’s a majestic deer, a busy rock pool or a yomp in the woods.</p> <a href=""https://www.theguardian.com/environment/2021/aug/27/nature-lovers-guardian-young-country-diary-writers"">Continue reading...</a>","Fri, 29 Nov 2024 09:06:07 GMT"
The Guardian,Tell us your favourite music albums of 2024,https://www.theguardian.com/music/2024/nov/28/tell-us-your-favourite-music-albums-of-2024,"<p>We would like to hear about the best album you have heard this year and why</p><p>It’s been one of the most exciting years for music in some time, with a proper changing of the guard at the top of pop: Sabrina Carpenter, Chappell Roan and Charli xcx have ushered in a new era of revelry, humour and inventiveness.</p><p>Elsewhere, new future-classicists such as MJ Lenderman and Mk.gee have broken through, while Sexxy Red and Glorilla have shaken up rap. But who made your album of the year, and why? Let us know and we’ll run the best submissions after the Guardian’s No 1 is unveiled in December.</p> <a href=""https://www.theguardian.com/music/2024/nov/28/tell-us-your-favourite-music-albums-of-2024"">Continue reading...</a>","Thu, 28 Nov 2024 15:45:14 GMT"
The Guardian,Women in the UK: are you planning on having a baby on your own using fertility treatment?,https://www.theguardian.com/society/2024/nov/26/women-in-the-uk-are-you-planning-on-having-a-baby-on-your-own-using-fertility-treatment,"<p>We’d like to hear from women who are having a baby on their own or with someone else using IVF or DI</p><p>According to a report by the Human Fertilisation and Embryology Authority (HFEA), the number of UK women who are single and undergoing fertility treatment has more than <a href=""https://www.theguardian.com/society/2024/nov/26/single-women-uk-fertility-treatment-yvf"">trebled in a decade</a>.</p><p>In total, 4,800 women without a partner had in vitro fertilisation (IVF) or donor insemination (DI) treatment in 2022. This represents a 243% increase from the 1,400 single women who had fertility treatment in 2012.</p> <a href=""https://www.theguardian.com/society/2024/nov/26/women-in-the-uk-are-you-planning-on-having-a-baby-on-your-own-using-fertility-treatment"">Continue reading...</a>","Tue, 26 Nov 2024 11:31:46 GMT"
The Guardian,Who is Bushra Bibi? Imran Khan’s wife stands at the forefront of the Pakistan protests,https://www.theguardian.com/world/2024/dec/02/bushra-bibi-wife-imran-khan-pakistan-protests,"<p>Elusive spouse of the former prime minister led march of tens of thousands on Islamabad</p><p>As vast crowds converged on Pakistan’s capital demanding the release of the former prime minister Imran Khan, one unlikely figure was at the forefront of the protest.</p><p>Bushra Bibi, Khan’s third wife, had always been deemed an apolitical and somewhat mysterious spiritual figure. Her marriage to Khan had generated wild gossip for years, but she kept herself largely shielded from the public gaze – even as she found herself jailed alongside her husband in January.</p> <a href=""https://www.theguardian.com/world/2024/dec/02/bushra-bibi-wife-imran-khan-pakistan-protests"">Continue reading...</a>","Mon, 02 Dec 2024 02:06:39 GMT"
The Guardian,Rebels behind Aleppo’s surprise fall took advantage of Russian and Iranian distraction,https://www.theguardian.com/world/2024/dec/01/rebels-behind-aleppos-surprise-fall-took-advantage-of-russian-and-iranian-distraction,"<p>Forces only took three days to take the city from Bashar al-Assad’s regime, but the Middle East’s newest conflict looks set to last</p><ul><li><strong><a href=""https://www.theguardian.com/world/live/2024/dec/01/middle-east-crisis-live-syria-rebels-aleppo-russia-airstrikes-assad"">Middle East crisis – live updates</a></strong></li></ul><p>It was not Kyiv that fell in three days, but Aleppo. A <a href=""https://www.theguardian.com/world/2024/dec/01/syria-iran-abbas-araghchi-damascas-visit-aleppo-fall-bashar-al-assad"">surprise offensive</a> launched by Syrian rebels from the north west of the country last week has reignited a dormant conflict – and revealed a change in the balance of power caused not by one but two nearby wars, in Ukraine and Lebanon and the Middle East.</p><p>Aleppo was the scene of fierce and destructive fighting between 2012 and 2016 when the Syrian civil war was at its height. Rebel groups were forced out as Syrian government forces supporting the president, Bashar al-Assad, were able to capture the country’s second city, with the help of Russia and its air force.</p> <a href=""https://www.theguardian.com/world/2024/dec/01/rebels-behind-aleppos-surprise-fall-took-advantage-of-russian-and-iranian-distraction"">Continue reading...</a>","Sun, 01 Dec 2024 19:10:19 GMT"
The Guardian,Weather tracker: lake-effect snow blankets parts of north-east US,https://www.theguardian.com/environment/2024/dec/02/weather-tracker-lake-effect-snow-north-east-us-new-york,"<p>There was significant snowfall in five states downwind of the Great Lakes, including 4ft in western New York state</p><p>As meteorological autumn drew to a close at the end of last week, parts of the north-east of the US saw substantial snowfall thanks to a phenomenon known as “lake-effect snow”.</p><p>This occurs when cold air passes over relatively warm lake waters, causing the layer of air near to the surface to absorb heat and moisture. Warmer than the air above it, this layer of air then starts to rise, cooling and condensing into clouds that deposit snow on the windward side of the lakes in extremely localised bands.</p> <a href=""https://www.theguardian.com/environment/2024/dec/02/weather-tracker-lake-effect-snow-north-east-us-new-york"">Continue reading...</a>","Mon, 02 Dec 2024 09:26:15 GMT"
The Guardian,"Doug Burgum could soon be driving Trump’s ‘drill, baby, drill’ promises on public lands",https://www.theguardian.com/us-news/ng-interactive/2024/dec/01/doug-burgum-trump-interior-secretary-drilling,"<p>Conservationists fear an expansion of drilling with North Dakota governor Trump’s pick for secretary of the interior and White House ‘energy czar’</p><p>Of all <a href=""https://www.theguardian.com/us-news/donaldtrump"">Donald Trump</a>’s <a href=""https://www.theguardian.com/us-news/2024/nov/19/trump-cabinet-picks-administration-appointees"">cabinet nominees</a> so far, Doug Burgum has stood out for appearing to be one of the most conventional.</p><p>The billionaire governor of North Dakota – like most picks to lead the Department of the Interior, the largest landowner in the US west – comes from a western state. He is not a conspiracy theorist, he hasn’t been investigated for sex trafficking. Unlike the president-elect’s pick to lead the Department of Energy, he is not a fracking CEO.</p> <a href=""https://www.theguardian.com/us-news/ng-interactive/2024/dec/01/doug-burgum-trump-interior-secretary-drilling"">Continue reading...</a>","Sun, 01 Dec 2024 16:00:10 GMT"
